{
  "thread": {
    "uuid": "debf9d6546f925c2e01f336f3521bd6bfdaa6885",
    "url": "https://www.varesenews.it/2025/03/metalmeccanici-in-sciopero-il-contratto-e-ancora-fermo/2199081",
    "site_full": "www.varesenews.it",
    "site": "varesenews.it",
    "site_section": "http://www.varesenews.it",
    "site_categories": [
      "media",
      "top_news_it",
      "top_news"
    ],
    "section_title": "Varese News | il quotidiano online della provincia di Varese",
    "site_title": "Varese News | il quotidiano online della provincia di Varese",
    "title": "Metalmeccanici in sciopero: il contratto è ancora fermo",
    "title_full": "Metalmeccanici in sciopero: il contratto è ancora fermo",
    "published": "2025-03-28T11:49:00.000+03:00",
    "replies_count": 0,
    "participants_count": 1,
    "site_type": "news",
    "country": "IT",
    "main_image": "https://www.varesenews.it/photogallery_new/images/2025/03/sindacato-1841424.610x431.jpg",
    "performance_score": 0,
    "domain_rank": 39597,
    "domain_rank_updated": "2025-03-24T23:00:00.000+02:00",
    "licensing_agency": [],
    "social": {
      "facebook": {
        "likes": 0,
        "comments": 0,
        "shares": 0
      },
      "vk": {
        "shares": 0
      }
    }
  },
  "uuid": "debf9d6546f925c2e01f336f3521bd6bfdaa6885",
  "url": "https://www.varesenews.it/2025/03/metalmeccanici-in-sciopero-il-contratto-e-ancora-fermo/2199081",
  "ord_in_thread": 0,
  "author": "Michele Mancino",
  "published": "2025-03-28T11:49:00.000+03:00",
  "title": "Metalmeccanici in sciopero: il contratto è ancora fermo",
  "text": "Metalmeccanici in sciopero: il contratto è ancora fermo\nFiom, Fim e Uilm contestano il ritorno al modello del 2016 e chiedono aumenti certi per contrastare l’inflazione. Federmeccanica non fa passi avanti, mentre cresce la tensione nelle trattative\nIl contratto dei lavoratori è scaduto a giugno dello scorso anno. I sindacati di categoria, Fiom, Fim e Ulm, hanno indetto complessivamente 24 ore di sciopero, ma il rinnovo ancora non c’è. Non è mai un buon segnale quando si accumulano ritardi su un contratto collettivo che ha una forte valenza politica e che, solitamente, apre la strada agli altri rinnovi. Previste per venerdì 28 marzo 8 ore di sciopero. In provincia di Varese presidi in piazza Monte Grappa a Varese, davanti allo stabilimento Beko di Cassinetta di Biandronno e in tutti gli stabiimenti Leonardo.\nMURO CONTRO MURO\nFedermeccanica vorrebbe tornare all’impostazione del contratto del 2016, che prevedeva un meccanismo di recupero automatico dell’inflazione senza stabilire una somma precisa. «Federmeccanica non ha fatto un solo passo avanti – commenta Nino Cartosio, segretario della Fiom Cgil – ma è proprio sulla scorta di quell’esperienza che già nel 2019-2020, in occasione del rinnovo, Fiom, Fim e Uilm chiesero di fissare una somma certa di aumento per contrastare l’inflazione».\nIl sindacato dei metalmeccanici contesta dunque a Federmeccanica l’intenzione di ignorare il contratto del 2021 e di tornare al modello del 2016, che già allora si rivelò insufficiente. Per questo, Fiom, Fim e Uilm chiedono alle aziende metalmeccaniche di definire una cifra chiara su cui ragionare.\nIl contesto economico non è dei migliori. Federmeccanica ha recentemente pubblicato i dati sull’andamento del settore. Sono dati negativi: c’è una contrazione del 4,2% della produzione industriale italiana e c’è un calo dell’export del 3,8%. «È difficile fare i contratti quando le cose non vanno bene dal punto di vista industriale economico, lo sappiamo benissimo- – continua Cartosio-. Ciò detto è chiaro che questa situazione viene usata in modo strumentale da Federmeccanica perché, dati alla mano, nel 2023 le aziende hanno fatto comunque 31 miliardi di utili».\nA RISCHIO LE RELAZIONI SINDACALI\n«Al di là del muro eretto da Federmeccanica e della messa in discussione del meccanismo salariale legato alla produzione – sottolinea Fabio Dell’Angelo, coordinatore della Uilm Altomilanese – c’è un atteggiamento che mina le relazioni sindacali. Eppure, insieme alle aziende, siamo riusciti ad attivare protocolli per garantire la continuità della produzione in situazioni emergenziali e difficili. Inoltre, la nostra piattaforma è stata votata dal 98% dei lavoratori, un dato senza precedenti. Segno che gli undici punti proposti sono essenziali in un momento di impoverimento generale del Paese».\nIL CONTRATTO NAZIONALE È UNA TUTELA\nIl sindacato dei metalmeccanici rivendica dunque la propria piattaforma, che non si limita alle richieste di aumento salariale e al contrasto dell’inflazione, ma include anche temi cruciali come la sicurezza sul lavoro e l’utilizzo degli ammortizzatori sociali. «Si è parlato di sostenibilità del contratto – conclude Gennaro Aloisio segretario della Fim Cisl dei laghi– ma in realtà la piattaforma votata dai lavoratori è innovativa e guarda proprio alla sostenibilità. Per le politiche attive e la gestione delle transizioni, chiediamo un incontro preventivo e un coordinamento con i rappresentanti dei lavoratori. Su questo punto, però, le imprese hanno alzato un muro, perché temono di perdere libertà d’azione».\nAloisio cita il caso Beko per esemplificare il problema: «La multinazionale turca ha dimostrato che, in Paesi con regole più lasche e contratti meno tutelanti, in dieci giorni ha licenziato duemila lavoratori. Qui, invece, grazie al nostro contratto nazionale e alla forza del sindacato, siamo arrivati a dieci trattative, stiamo riducendo gli esuberi e soprattutto stiamo trattando».\nLeggi i commenti\nTAG ARTICOLO\nAccedi o registrati per commentare questo articolo.\nL'email è richiesta ma non verrà mostrata ai visitatori. Il contenuto di questo commento esprime il pensiero dell'autore e non rappresenta la linea editoriale di VareseNews.it, che rimane autonoma e indipendente. I messaggi inclusi nei commenti non sono testi giornalistici, ma post inviati dai singoli lettori che possono essere automaticamente pubblicati senza filtro preventivo. I commenti che includano uno o più link a siti esterni verranno rimossi in automatico dal sistema.",
  "highlightText": "",
  "highlightTitle": "",
  "highlightThreadTitle": "",
  "language": "italian",
  "sentiment": "negative",
  "categories": [
    "Labor"
  ],
  "topics": [
    "Labor->labour dispute",
    "Labor->collective agreements",
    "Labor->labour relations"
  ],
  "ai_allow": true,
  "has_canonical": false,
  "breaking": true,
  "webz_reporter": false,
  "external_links": [],
  "entities": {
    "persons": [
      {
        "name": "Federmeccanica non fa passi avanti",
        "sentiment": "negative"
      },
      {
        "name": "mentre cresce la",
        "sentiment": "negative"
      },
      {
        "name": "accumulano ritardi su un",
        "sentiment": "negative"
      },
      {
        "name": "contratto collettivo che",
        "sentiment": "negative"
      },
      {
        "name": "agli altri",
        "sentiment": "negative"
      },
      {
        "name": "tutti gli",
        "sentiment": "negative"
      },
      {
        "name": "Leonardo",
        "sentiment": "negative"
      },
      {
        "name": "Federmeccanica vorrebbe",
        "sentiment": "negative"
      },
      {
        "name": "meccanismo di recupero",
        "sentiment": "negative"
      },
      {
        "name": "Nino Cartosio",
        "sentiment": "negative"
      },
      {
        "name": "Fiom Cgil",
        "sentiment": "negative"
      },
      {
        "name": "sulla scorta di quell’esperienza che già nel",
        "sentiment": "negative"
      },
      {
        "name": "somma certa di aumento",
        "sentiment": "negative"
      },
      {
        "name": "chiara su cui ragionare",
        "sentiment": "negative"
      },
      {
        "name": "calo dell’export",
        "sentiment": "negative"
      },
      {
        "name": "lo sappiamo",
        "sentiment": "negative"
      },
      {
        "name": "Ciò detto è chiaro che questa situazione viene usata",
        "sentiment": "negative"
      },
      {
        "name": "da Federmeccanica perché",
        "sentiment": "negative"
      },
      {
        "name": "da Federmeccanica e della messa",
        "sentiment": "negative"
      },
      {
        "name": "Fabio",
        "sentiment": "negative"
      },
      {
        "name": "coordinatore della",
        "sentiment": "negative"
      },
      {
        "name": "Uilm Altomilanese",
        "sentiment": "negative"
      },
      {
        "name": "Eppure",
        "sentiment": "negative"
      },
      {
        "name": "insieme alle aziende",
        "sentiment": "negative"
      },
      {
        "name": "attivare protocolli per garantire la continuità",
        "sentiment": "negative"
      },
      {
        "name": "stata votata dal",
        "sentiment": "negative"
      },
      {
        "name": "Segno che gli",
        "sentiment": "negative"
      },
      {
        "name": "rivendica dunque la propria piattaforma",
        "sentiment": "negative"
      },
      {
        "name": "ma",
        "sentiment": "negative"
      },
      {
        "name": "l’utilizzo degli",
        "sentiment": "negative"
      },
      {
        "name": "ammortizzatori sociali",
        "sentiment": "negative"
      },
      {
        "name": "«Si è parlato di sostenibilità del contratto",
        "sentiment": "negative"
      },
      {
        "name": "Gennaro Aloisio",
        "sentiment": "negative"
      },
      {
        "name": "rappresentanti dei lavoratori",
        "sentiment": "negative"
      },
      {
        "name": "Su questo punto",
        "sentiment": "negative"
      },
      {
        "name": "dimostrato che",
        "sentiment": "negative"
      },
      {
        "name": "meno tutelanti",
        "sentiment": "negative"
      },
      {
        "name": "Qui",
        "sentiment": "negative"
      },
      {
        "name": "verranno rimossi",
        "sentiment": "negative"
      }
    ],
    "locations": [
      {
        "name": "sciopero",
        "sentiment": "negative"
      },
      {
        "name": "giugno",
        "sentiment": "negative"
      },
      {
        "name": "provincia di Varese",
        "sentiment": "negative"
      },
      {
        "name": "Monte Grappa",
        "sentiment": "negative"
      },
      {
        "name": "davanti allo",
        "sentiment": "negative"
      },
      {
        "name": "del contratto",
        "sentiment": "negative"
      },
      {
        "name": "dati",
        "sentiment": "negative"
      },
      {
        "name": "del settore",
        "sentiment": "negative"
      },
      {
        "name": "c’è una",
        "sentiment": "negative"
      },
      {
        "name": "del muro",
        "sentiment": "negative"
      },
      {
        "name": "siamo",
        "sentiment": "negative"
      },
      {
        "name": "però",
        "sentiment": "negative"
      },
      {
        "name": "stiamo",
        "sentiment": "negative"
      }
    ],
    "organizations": [
      {
        "name": "Metalmeccanici",
        "sentiment": "negative",
        "tickers": []
      },
      {
        "name": "il contratto è ancora fermo\nFiom, Fim e Uilm contestano il ritorno al modello",
        "sentiment": "negative",
        "tickers": []
      },
      {
        "name": "chiedono aumenti certi",
        "sentiment": "negative",
        "tickers": []
      },
      {
        "name": "Il contratto dei lavoratori è",
        "sentiment": "negative",
        "tickers": []
      },
      {
        "name": "Fiom, Fim e Ulm",
        "sentiment": "negative",
        "tickers": []
      },
      {
        "name": "hanno indetto",
        "sentiment": "negative",
        "tickers": []
      },
      {
        "name": "ma il rinnovo ancora non c’è",
        "sentiment": "negative",
        "tickers": []
      },
      {
        "name": "Non è mai un",
        "sentiment": "negative",
        "tickers": []
      },
      {
        "name": "politica e che",
        "sentiment": "negative",
        "tickers": []
      },
      {
        "name": "apre la strada",
        "sentiment": "negative",
        "tickers": []
      },
      {
        "name": "Beko di Cassinetta di Biandronno",
        "sentiment": "negative",
        "tickers": []
      },
      {
        "name": "che prevedeva un",
        "sentiment": "negative",
        "tickers": []
      },
      {
        "name": "senza stabilire una somma precisa",
        "sentiment": "negative",
        "tickers": []
      },
      {
        "name": "passo avanti",
        "sentiment": "negative",
        "tickers": []
      },
      {
        "name": "di definire una cifra",
        "sentiment": "negative",
        "tickers": []
      },
      {
        "name": "Il contesto economico non è dei migliori",
        "sentiment": "negative",
        "tickers": []
      },
      {
        "name": "Sono dati negativi",
        "sentiment": "negative",
        "tickers": []
      },
      {
        "name": "della produzione industriale italiana e c’è un",
        "sentiment": "negative",
        "tickers": []
      },
      {
        "name": "quando le cose non vanno bene dal punto di vista industriale economico",
        "sentiment": "negative",
        "tickers": []
      },
      {
        "name": "dati alla mano",
        "sentiment": "negative",
        "tickers": []
      },
      {
        "name": "fatto comunque 31 miliardi di utili»",
        "sentiment": "negative",
        "tickers": []
      },
      {
        "name": "RISCHIO LE RELAZIONI SINDACALI",
        "sentiment": "negative",
        "tickers": []
      },
      {
        "name": "discussione del meccanismo salariale legato alla produzione",
        "sentiment": "negative",
        "tickers": []
      },
      {
        "name": "c’è un atteggiamento che mina le",
        "sentiment": "negative",
        "tickers": []
      },
      {
        "name": "situazioni emergenziali e difficili",
        "sentiment": "negative",
        "tickers": []
      },
      {
        "name": "un dato senza precedenti",
        "sentiment": "negative",
        "tickers": []
      },
      {
        "name": "sono essenziali",
        "sentiment": "negative",
        "tickers": []
      },
      {
        "name": "IL CONTRATTO NAZIONALE È UNA TUTELA",
        "sentiment": "negative",
        "tickers": []
      },
      {
        "name": "che non si limita alle richieste di aumento salariale e al contrasto dell’inflazione",
        "sentiment": "negative",
        "tickers": []
      },
      {
        "name": "anche temi cruciali come la sicurezza sul lavoro e",
        "sentiment": "negative",
        "tickers": []
      },
      {
        "name": "della Fim Cisl dei",
        "sentiment": "negative",
        "tickers": []
      },
      {
        "name": "dai lavoratori è innovativa e guarda proprio alla sostenibilità",
        "sentiment": "negative",
        "tickers": []
      },
      {
        "name": "un incontro preventivo e un",
        "sentiment": "negative",
        "tickers": []
      },
      {
        "name": "le imprese hanno alzato",
        "sentiment": "negative",
        "tickers": []
      },
      {
        "name": "un muro",
        "sentiment": "negative",
        "tickers": []
      },
      {
        "name": "Aloisio cita il caso Beko",
        "sentiment": "negative",
        "tickers": []
      },
      {
        "name": "al nostro",
        "sentiment": "negative",
        "tickers": []
      },
      {
        "name": "contratto nazionale e alla forza del sindacato",
        "sentiment": "negative",
        "tickers": []
      },
      {
        "name": "siamo arrivati",
        "sentiment": "negative",
        "tickers": []
      },
      {
        "name": "Leggi",
        "sentiment": "negative",
        "tickers": []
      },
      {
        "name": "commentare questo articolo",
        "sentiment": "negative",
        "tickers": []
      },
      {
        "name": "è richiesta ma",
        "sentiment": "negative",
        "tickers": []
      },
      {
        "name": "Il contenuto di questo commento esprime il pensiero dell'autore",
        "sentiment": "negative",
        "tickers": []
      },
      {
        "name": "che rimane autonoma e indipendente",
        "sentiment": "negative",
        "tickers": []
      },
      {
        "name": "messaggi inclusi nei commenti non sono testi giornalistici",
        "sentiment": "negative",
        "tickers": []
      },
      {
        "name": "dai singoli lettori che possono essere",
        "sentiment": "negative",
        "tickers": []
      },
      {
        "name": "automaticamente pubblicati senza filtro preventivo",
        "sentiment": "negative",
        "tickers": []
      },
      {
        "name": "automatico dal sistema",
        "sentiment": "negative",
        "tickers": []
      }
    ]
  },
  "syndication": {
    "syndicated": null,
    "syndicate_id": null,
    "first_syndicated": false
  },
  "trust": {
    "categories": []
  },
  "rating": null,
  "crawled": "2025-03-28T11:56:13.694+03:00",
  "updated": "2025-03-28T11:56:13.694+03:00"
}