{
  "thread": {
    "uuid": "b5a521e278fa73fe5de96af86fe3cd7ccaf2cc14",
    "url": "https://askanews.it/2025/03/28/metalmeccanici-al-via-manifestazioni-in-tutta-italia",
    "site_full": "askanews.it",
    "site": "askanews.it",
    "site_section": "https://www.gazzettamatin.com/gazzettamatin/feed",
    "site_categories": [],
    "section_title": "Aosta News, notizie di cronaca, informazioni sportive, news, eventi e spettacoli della Valle d&#039;Aosta",
    "site_title": "Askanews - Notizie, approfondimenti e news dell'ultima ora di economia, cronaca, politica, cultura, spettacolo e altri temi di attualit&agrave;",
    "title": "Metalmeccanici, al via manifestazioni in tutta Italia",
    "title_full": "Metalmeccanici, al via manifestazioni in tutta Italia",
    "published": "2025-03-28T12:49:00.000+03:00",
    "replies_count": 0,
    "participants_count": 1,
    "site_type": "news",
    "country": "IT",
    "main_image": "https://askanews.it/wp-content/uploads/2025/03/20250328_104807_5CF6EC28.jpg",
    "performance_score": 0,
    "domain_rank": 32898,
    "domain_rank_updated": "2025-03-24T23:00:00.000+02:00",
    "licensing_agency": [],
    "social": {
      "facebook": {
        "likes": 0,
        "comments": 0,
        "shares": 0
      },
      "vk": {
        "shares": 0
      }
    }
  },
  "uuid": "b5a521e278fa73fe5de96af86fe3cd7ccaf2cc14",
  "url": "https://askanews.it/2025/03/28/metalmeccanici-al-via-manifestazioni-in-tutta-italia",
  "ord_in_thread": 0,
  "author": "admin",
  "published": "2025-03-28T12:49:00.000+03:00",
  "title": "Metalmeccanici, al via manifestazioni in tutta Italia",
  "text": "Roma, 28 mar. (askanews) – Al via in tutta Italia le manifestazioni dei metalmeccanici che protestano per il rinnovo del contratto. La trattativa per il rinnovo del contratto è bloccata dal 12 novembre scorso e, con una nota congiunta, Fim, Fiom e Uilm ricordano di aver avanzato proposte per rilanciare l’industria e il lavoro nel settore. “Vogliamo confermare le norme del precedente contratto e stabilire gli aumenti in particolare riguardo al salario – dicono i sindacati di categoria – loro (Federmeccanica) non vogliono dare certezza e garantire sugli aumenti”.\n“Tutti parlano dei bassi salari, tutti raccontano dei bassi salari ma quando gli diciamo che vogliamo contrattare Federmeccanica non si siede al tavolo: è un atto antidemocratico, noi non ci fermeremo fino a quando non riprenderemo la trattativa e porteremo a casa il rinnovo del contratto nazionale”, ha affermato Michele De Palma, segretario generale Fiom Cgil alla manifestazione di Reggio Emilia.\nSecondo la leader Cisl, Daniela Fumarola “è inaccettabile che, dopo mesi di trattative interrotte, Federmeccanica e Assistal continuino a ignorare legittime richieste sindacali. Il contratto collettivo è fondamentale per adeguare i salari al costo della vita, migliorare le condizioni di lavoro, generare e redistribuire crescita garantendo maggiore sicurezza, soprattutto negli appalti. Rifiutarsi di rinnovare significa mortificare la dignità, il valore e il ruolo di chi, ogni giorno, contribuisce alla crescita del Paese in settori strategici”, scrive sui social.\n“In una situazione come questa, dove ci sono i dazi, la prima cosa importante sono le fabbriche e i lavoratori. I lavoratori difendono l’Italia, difendono la manifattura e con la loro azione hanno sempre debellato questioni negative”, ha rivendicato il segretario generale Uilm, Rocco Palombella alla manifestazione a Napoli.\n[Lavoratori in piazza per il rinnovo del contratto|PN_20250328_00023|gn00 atlk in02 rg00|https://askanews.it/wp-content/uploads/2025/03/20250328_104807_5CF6EC28.jpg|28/03/2025 10:48:14|Metalmeccanici, al via manifestazioni in tutta Italia|Lavoro|Economia, Regionali]",
  "highlightText": "",
  "highlightTitle": "",
  "highlightThreadTitle": "",
  "language": "italian",
  "sentiment": "negative",
  "categories": [
    "Labor"
  ],
  "topics": [
    "Labor->collective agreements",
    "Labor->unions",
    "Labor->employment"
  ],
  "ai_allow": true,
  "has_canonical": false,
  "breaking": false,
  "webz_reporter": false,
  "external_links": [],
  "entities": {
    "persons": [
      {
        "name": "La",
        "sentiment": "negative"
      },
      {
        "name": "al salario",
        "sentiment": "negative"
      },
      {
        "name": "di categoria",
        "sentiment": "negative"
      },
      {
        "name": "bassi salari ma quando gli diciamo che vogliamo",
        "sentiment": "negative"
      },
      {
        "name": "Federmeccanica non si siede al tavolo:",
        "sentiment": "negative"
      },
      {
        "name": "Michele De Palma",
        "sentiment": "negative"
      },
      {
        "name": "Daniela Fumarola",
        "sentiment": "negative"
      },
      {
        "name": "al costo della vita",
        "sentiment": "negative"
      },
      {
        "name": "soprattutto negli appalti",
        "sentiment": "negative"
      },
      {
        "name": "dazi",
        "sentiment": "negative"
      },
      {
        "name": "difendono la manifattura e con la loro",
        "sentiment": "negative"
      },
      {
        "name": "sempre debellato",
        "sentiment": "negative"
      },
      {
        "name": "rivendicato il segretario generale Uilm",
        "sentiment": "negative"
      },
      {
        "name": "Rocco Palombella alla manifestazione",
        "sentiment": "negative"
      },
      {
        "name": "Rifiutarsi di",
        "sentiment": "neutral"
      },
      {
        "name": "scrive sui",
        "sentiment": "neutral"
      }
    ],
    "locations": [
      {
        "name": "Roma",
        "sentiment": "negative"
      },
      {
        "name": "Napoli",
        "sentiment": "negative"
      }
    ],
    "organizations": [
      {
        "name": "tutta Italia le",
        "sentiment": "negative",
        "tickers": []
      },
      {
        "name": "con una",
        "sentiment": "negative",
        "tickers": []
      },
      {
        "name": "l’industria e il lavoro nel settore",
        "sentiment": "negative",
        "tickers": []
      },
      {
        "name": "Vogliamo confermare le norme del precedente contratto e stabilire gli aumenti",
        "sentiment": "negative",
        "tickers": []
      },
      {
        "name": "tutti raccontano dei",
        "sentiment": "negative",
        "tickers": []
      },
      {
        "name": "è un atto antidemocratico",
        "sentiment": "negative",
        "tickers": []
      },
      {
        "name": "noi non ci fermeremo fino",
        "sentiment": "negative",
        "tickers": []
      },
      {
        "name": "casa il rinnovo del contratto nazionale",
        "sentiment": "negative",
        "tickers": []
      },
      {
        "name": "Fiom Cgil",
        "sentiment": "negative",
        "tickers": []
      },
      {
        "name": "Secondo la",
        "sentiment": "negative",
        "tickers": []
      },
      {
        "name": "Cisl",
        "sentiment": "negative",
        "tickers": []
      },
      {
        "name": "Il contratto collettivo è fondamentale per",
        "sentiment": "negative",
        "tickers": []
      },
      {
        "name": "migliorare le condizioni di lavoro",
        "sentiment": "negative",
        "tickers": []
      },
      {
        "name": "generare e redistribuire crescita garantendo maggiore sicurezza",
        "sentiment": "negative",
        "tickers": []
      },
      {
        "name": "la prima cosa importante sono le",
        "sentiment": "negative",
        "tickers": []
      },
      {
        "name": "il valore e il ruolo di chi",
        "sentiment": "neutral",
        "tickers": []
      },
      {
        "name": "contribuisce alla crescita del Paese",
        "sentiment": "neutral",
        "tickers": []
      }
    ]
  },
  "syndication": {
    "syndicated": null,
    "syndicate_id": null,
    "first_syndicated": false
  },
  "trust": {
    "categories": []
  },
  "rating": null,
  "crawled": "2025-03-28T13:48:18.775+03:00",
  "updated": "2025-03-28T13:49:55.876+03:00"
}