{
  "thread": {
    "uuid": "8452dd64c89f3000b2a433ac2da3da9dd740e1c6",
    "url": "https://www.latestnigeriannews.com/p/4218921/lagride-drivers-threaten-boycott-over-alleged-harassment-by-operators.html",
    "site_full": "www.latestnigeriannews.com",
    "site": "latestnigeriannews.com",
    "site_section": "http://www.latestnigeriannews.com/feed//rss.xml",
    "site_categories": [
      "media"
    ],
    "section_title": "Latest Nigerian News Headlines",
    "site_title": "Latesnigeriannews Mobile Index",
    "title": "LagRide drivers threaten boycott over alleged harassment by operators",
    "title_full": "LagRide drivers threaten boycott over alleged harassment by operators",
    "published": "2025-03-28T09:01:00.000+03:00",
    "replies_count": 0,
    "participants_count": 1,
    "site_type": "news",
    "country": "AU",
    "main_image": "",
    "performance_score": 0,
    "domain_rank": 75451,
    "domain_rank_updated": "2025-03-24T23:00:00.000+02:00",
    "licensing_agency": [],
    "social": {
      "facebook": {
        "likes": 0,
        "comments": 0,
        "shares": 0
      },
      "vk": {
        "shares": 0
      }
    }
  },
  "uuid": "8452dd64c89f3000b2a433ac2da3da9dd740e1c6",
  "url": "https://www.latestnigeriannews.com/p/4218921/lagride-drivers-threaten-boycott-over-alleged-harassment-by-operators.html",
  "ord_in_thread": 0,
  "author": "Latestnigeriannews",
  "published": "2025-03-28T09:01:00.000+03:00",
  "title": "LagRide drivers threaten boycott over alleged harassment by operators",
  "text": "-- External Links --\nPunch\nVanguard\nThisday\nGuardian\nDaily Sun\nThe Nation\nDaily Independent\nLeadership\nTribune\nNational Mirror\nDaily Trust\nDaily Times\nBusinessDay\nSahara Reporters\nPremium Times\nPM News\nTori\nLinda Ikeji\nBella Naija\nNairaland\nCNN\nBBC\nAljazeera\nGoal\nAfrican Football\nBleacher Report\n90min\nComplete Sports\n|\n|\n|\n|\n|\n|\n|\n|\n|\n|\n|\n|\n|\n|\n|\n|\n|\n|\n|\n|\nViewing Mode:\nMedium\nVanguard\nPunch\nGuardian\nThisday\nDaily Sun\nLeadership\nTribune\nDaily Trust\nDaily Times\nDaily Independent\nThe Nation\nNational Mirror\nBusinessDay\nSahara Reporters\nSports\nEntertainment\nWorld\nTechnology\nBusiness\nPolitics\nFeatures\nColumns\nNigerian Jobs\nDay\n01\n02\n03\n04\n05\n06\n07\n08\n09\n10\n11\n12\n13\n14\n15\n16\n17\n18\n19\n20\n21\n22\n23\n24\n25\n26\n27\n28\n29\n30\n31\nMonth\nJan\nFeb\nMar\nApr\nMay\nJun\nJul\nAug\nSep\nOct\nNov\nDec\nYear\n2024\n2023\n2022\n2021\n2020\n2019\n2018\n2017\n2016\n2015\n2014\n2013\n2012\n2011\nArchive:\nEntertainment Headlines Today\n[Fri-28-Mar-2025]\n-\n-\n-\n-\n-\n-\n-\n-\n-\nClick to view all Entertainment headlines today\nSports Headlines Today\n[Fri-28-Mar-2025]\n-\n-\n-\n-\n-\n-\n-\n-\n-\nClick to view all Sports headlines today\nLagRide drivers threaten boycott over alleged harassment by operators\nPublished by\nNairametrics\non Fri, 28 Mar 2025\nDrivers under the government-backed ride-hailing platform, LagRide, have threatened to withdraw their services following threats by the platforms operators to involve the Lagos State Task Force in arresting them over alleged misconduct. The Amalgamated Union of App-Based Transporters of Nigeria (AUATON) revealed this development through its Public Relations Officer (PRO), Mr. Steven Iwindoye, in Ikeja []The post LagRide drivers threaten boycott over alleged harassment by operators appeared first on Nairametrics.\nClick here to read full news..\nAll Channels\nNigerian Dailies:\nPunch\n|\nVanguard\n|\nThe Nation\n|\nThisday\n|\nDaily Sun\n|\nGuardian\n|\nDaily Times\n|\nDaily Trust\n|\nDaily Independent\n|\nThe Herald\n|\nTribune\n|\nLeadership\n|\nNational Mirror\n|\nBusinessDay\n|\nNew Telegraph\n|\nPeoples Daily\n|\nBlueprint\n|\nNigerian Pilot\n|\nSahara Reporters\n|\nPremium Times\n|\nThe Cable\n|\nPM News\n|\nAPO Africa Newsroom\nCategories Today:\nWorld\n|\nSports\n|\nTechnology\n|\nEntertainment\n|\nBusiness\n|\nPolitics\n|\nColumns\n|\nAll Headlines Today\nEntertainment (Local):\nLinda Ikeji\n|\nBella Naija\n|\nTori\n|\nDaily News 24\n|\nPulse\n|\nThe NET\n|\nDailyPost\n|\nInformation Nigeria\n|\nGistlover\n|\nLailas Blog\n|\nMiss Petite\n|\nOlufamous\n|\nStella Dimoko Korkus Blog\n|\nYnaija\n|\nAll Entertainment News Today\nEntertainment (World):\nTMZ\n|\nDaily Mail\n|\nHuffington Post\nSports:\nGoal\n|\nAfrican Football\n|\nBleacher Report\n|\nFTBpro\n|\nKickoff\n|\nAll Sports Headlines Today\nBusiness & Finance:\nNairametrics\n|\nNigerian Tenders\n|\nBusiness Insider\n|\nForbes\n|\nEntrepreneur\n|\nThe Economist\n|\nBusinessTech\n|\nFinancial Watch\n|\nBusinessDay\n|\nAll Business News Headlines Today\nTechnology (Local):\nTechpoint\n|\nTechMoran\n|\nTechCity\n|\nInnovation Village\n|\nIT News Africa\n|\nTechnology Times\n|\nTechnext\n|\nTechcabal\n|\nAll Technology News Headlines Today\nTechnology (World):\nTechcrunch\n|\nTechmeme\n|\nSlashdot\n|\nWired\n|\nHackers News\n|\nEngadget\n|\nPocket Lint\n|\nThe Verge\nInternational Networks:\n|\nCNN\n|\nBBC\n|\nAl Jazeera\n|\nYahoo\nForum:\n|\nNairaland\n|\nNaij\nOther Links:\nHome\n|\nNigerian Jobs\nHome\n|\nAbout Us\n|\nContact Us\n|\nDisclaimer\n|\nPrivacy Policy\n|\nCopyright\n|\nSubscribe To News Alert\n|\nFacebook\n|\nTwitter\nAll trademarks and copyrights on this page are owned by their respective owners\nCopyright Â© 2025. latestnigeriannews.com - All rights reserved",
  "highlightText": "",
  "highlightTitle": "",
  "highlightThreadTitle": "",
  "language": "english",
  "sentiment": "negative",
  "categories": [
    "Social Issue",
    "Labor"
  ],
  "topics": [
    "Social Issue->discrimination",
    "Social Issue->social problem",
    "Labor->labour dispute",
    "Labor->labour relations",
    "Labor->gig economy"
  ],
  "ai_allow": true,
  "has_canonical": false,
  "breaking": false,
  "webz_reporter": false,
  "external_links": [],
  "entities": {
    "persons": [
      {
        "name": "LagRide",
        "sentiment": "negative"
      },
      {
        "name": "Linda Ikeji",
        "sentiment": "neutral"
      },
      {
        "name": "Steven Iwindoye",
        "sentiment": "neutral"
      },
      {
        "name": "Stella Dimoko Korkus",
        "sentiment": "neutral"
      }
    ],
    "locations": [
      {
        "name": "Innovation Village",
        "sentiment": "negative"
      },
      {
        "name": "News Africa",
        "sentiment": "negative"
      },
      {
        "name": "Us",
        "sentiment": "negative"
      },
      {
        "name": "Sahara",
        "sentiment": "neutral"
      },
      {
        "name": "Herald",
        "sentiment": "neutral"
      },
      {
        "name": "Nigeria",
        "sentiment": "neutral"
      },
      {
        "name": "Gistlover",
        "sentiment": "neutral"
      },
      {
        "name": "Olufamous",
        "sentiment": "neutral"
      }
    ],
    "organizations": [
      {
        "name": "CNN",
        "sentiment": "negative",
        "tickers": []
      },
      {
        "name": "BBC",
        "sentiment": "negative",
        "tickers": []
      },
      {
        "name": "the Lagos State Task Force",
        "sentiment": "negative",
        "tickers": []
      },
      {
        "name": "Bleacher Report",
        "sentiment": "negative",
        "tickers": []
      },
      {
        "name": "Business & Finance",
        "sentiment": "negative",
        "tickers": []
      },
      {
        "name": "Nigerian Tenders",
        "sentiment": "negative",
        "tickers": []
      },
      {
        "name": "Forbes",
        "sentiment": "negative",
        "tickers": []
      },
      {
        "name": "BusinessTech",
        "sentiment": "negative",
        "tickers": []
      },
      {
        "name": "Financial Watch",
        "sentiment": "negative",
        "tickers": []
      },
      {
        "name": "TechMoran",
        "sentiment": "negative",
        "tickers": []
      },
      {
        "name": "Technology Times",
        "sentiment": "negative",
        "tickers": []
      },
      {
        "name": "All Technology News",
        "sentiment": "negative",
        "tickers": []
      },
      {
        "name": "Techcrunch",
        "sentiment": "negative",
        "tickers": []
      },
      {
        "name": "Engadget",
        "sentiment": "negative",
        "tickers": []
      },
      {
        "name": "The Verge\nInternational Networks",
        "sentiment": "negative",
        "tickers": []
      },
      {
        "name": "Al Jazeera",
        "sentiment": "negative",
        "tickers": []
      },
      {
        "name": "Facebook",
        "sentiment": "negative",
        "tickers": []
      },
      {
        "name": "Twitter",
        "sentiment": "negative",
        "tickers": []
      },
      {
        "name": "Guardian\nDaily Sun",
        "sentiment": "neutral",
        "tickers": []
      },
      {
        "name": "The Nation\nDaily Independent\nLeadership\nTribune",
        "sentiment": "neutral",
        "tickers": []
      },
      {
        "name": "National Mirror\nDaily Trust\nDaily Times",
        "sentiment": "neutral",
        "tickers": []
      },
      {
        "name": "Premium Times",
        "sentiment": "neutral",
        "tickers": []
      },
      {
        "name": "PM News",
        "sentiment": "neutral",
        "tickers": []
      },
      {
        "name": "Aljazeera",
        "sentiment": "neutral",
        "tickers": []
      },
      {
        "name": "Complete Sports",
        "sentiment": "neutral",
        "tickers": []
      },
      {
        "name": "Daily Sun\nLeadership\nTribune\nDaily Trust\nDaily Times\nDaily Independent",
        "sentiment": "neutral",
        "tickers": []
      },
      {
        "name": "National Mirror\nBusinessDay",
        "sentiment": "neutral",
        "tickers": []
      },
      {
        "name": "Sports\nEntertainment",
        "sentiment": "neutral",
        "tickers": []
      },
      {
        "name": "Nairametrics",
        "sentiment": "neutral",
        "tickers": []
      },
      {
        "name": "The Amalgamated Union of App-Based Transporters of Nigeria",
        "sentiment": "neutral",
        "tickers": []
      },
      {
        "name": "Channels\nNigerian Dailies",
        "sentiment": "neutral",
        "tickers": []
      },
      {
        "name": "Peoples Daily",
        "sentiment": "neutral",
        "tickers": []
      },
      {
        "name": "APO Africa Newsroom",
        "sentiment": "neutral",
        "tickers": []
      },
      {
        "name": "Bella Naija",
        "sentiment": "neutral",
        "tickers": []
      },
      {
        "name": "Daily News",
        "sentiment": "neutral",
        "tickers": []
      },
      {
        "name": "DailyPost",
        "sentiment": "neutral",
        "tickers": []
      },
      {
        "name": "TMZ",
        "sentiment": "neutral",
        "tickers": []
      },
      {
        "name": "Daily Mail",
        "sentiment": "neutral",
        "tickers": []
      },
      {
        "name": "Huffington Post\nSports",
        "sentiment": "neutral",
        "tickers": []
      }
    ]
  },
  "syndication": {
    "syndicated": false,
    "syndicate_id": null,
    "first_syndicated": false
  },
  "trust": {
    "categories": []
  },
  "rating": null,
  "crawled": "2025-03-28T09:47:23.006+03:00",
  "updated": "2025-03-28T09:47:23.006+03:00"
}