{
  "thread": {
    "uuid": "f6dcfd7fb816a3b0cf1fe615f22c1151fc71ae75",
    "url": "https://www.lasicilia.it/lavoro/sicilia-tra-le-prime-cinque-regioni-italiane-per-numero-di-controversie-lavorative-2449965",
    "site_full": "www.lasicilia.it",
    "site": "lasicilia.it",
    "site_section": "https://lasicilia.it/feed",
    "site_categories": [
      "media",
      "top_news_it",
      "top_news"
    ],
    "section_title": "La Sicilia",
    "site_title": "La Sicilia - PRIMA PAGINA",
    "title": "Sicilia tra le prime cinque regioni italiane per numero di controversie lavorative",
    "title_full": "Sicilia tra le prime cinque regioni italiane per numero di controversie lavorative",
    "published": "2025-03-27T15:19:00.000+02:00",
    "replies_count": 0,
    "participants_count": 1,
    "site_type": "news",
    "country": "IT",
    "main_image": "https://www.lasicilia.it/wp-content/uploads/2025/03/controversie1.jpg?quality=75&resize=1120%2C630",
    "performance_score": 0,
    "domain_rank": 50184,
    "domain_rank_updated": "2025-03-24T23:00:00.000+02:00",
    "licensing_agency": [],
    "social": {
      "facebook": {
        "likes": 0,
        "comments": 0,
        "shares": 0
      },
      "vk": {
        "shares": 0
      }
    }
  },
  "uuid": "f6dcfd7fb816a3b0cf1fe615f22c1151fc71ae75",
  "url": "https://www.lasicilia.it/lavoro/sicilia-tra-le-prime-cinque-regioni-italiane-per-numero-di-controversie-lavorative-2449965",
  "ord_in_thread": 0,
  "author": "Alfredo Zermo",
  "published": "2025-03-27T15:19:00.000+02:00",
  "title": "Sicilia tra le prime cinque regioni italiane per numero di controversie lavorative",
  "text": "I NUMERI\nSicilia tra le prime cinque regioni italiane per numero di controversie lavorative\nSono quasi 10mila i lavoratori siciliani coinvolti in contenziosi con i propri datori di lavoro\nLa Sicilia è tra le prime cinque regioni italiane per numero di controversie lavorative, insieme a Lombardia, Lazio, Campania e Puglia, e sono in aumento le controversie per licenziamenti nel settore turismo e agricoltura. Sono quasi 10mila i lavoratori siciliani coinvolti in contenziosi con i propri datori di lavoro. Un dato che evidenzia come lo strumento della conciliazione sindacale sia utile e fondamentale per dirimere le controversie lavorative che vedono al primo posto i licenziamenti (40%), seguono le controversie su straordinari e ferie (25%) e le controversie su discriminazioni e mobbing (15%).\nI numeri sono stati diffusi in una nota dal Sinalp Sicilia, il sindacato nazionale autonomo dei lavoratori e dei pensionati che domani, venerdì 28 marzo alle 9,30, ha organizzato allo Steri, a Palermo, il convegno «La conciliazione sindacale: un’opportunità per le imprese e per i lavoratori».\nIn Sicilia, la conciliazione sindacale ha un tasso di conflittualità lavorativa più alto rispetto alla media nazionale, soprattutto per lavoro irregolare, mancato pagamento di retribuzioni, licenziamenti illegittimi, controversie su ferie, permessi e straordinari non retribuiti. Tra il 2019 e il 2023 le conciliazioni avviate in media 8.400 (si passa da 8.500 nel 2019 a 9.500 nel 2023), con una media di circa il 10% in più rispetto ai dati nazionali.\n«L’obiettivo di questo convegno – dice Andrea Monteleone, segretario regionale del Sinalp – è quello di approfondire il ruolo e le potenzialità della conciliazione sindacale, analizzando le opportunità che essa offre sia alle imprese, in termini di miglioramento delle relazioni industriali e della produttività, sia ai lavoratori, garantendo la tutela dei diritti e una maggiore partecipazione al processo decisionale. Inoltre – conclude il segretario – diventa un supporto essenziale di aiuto allo snellimento delle cause nei tribunali, che in questo modo non dovranno gravarsi di ulteriori contenziosi».COPYRIGHT LASICILIA.IT © RIPRODUZIONE RISERVATA",
  "highlightText": "",
  "highlightTitle": "",
  "highlightThreadTitle": "",
  "language": "italian",
  "sentiment": "negative",
  "categories": [
    "Labor",
    "Economy, Business and Finance"
  ],
  "topics": [
    "Labor->labour dispute",
    "Labor->employment legislation",
    "Labor->labour market",
    "Economy, Business and Finance->business reporting and performance",
    "Economy, Business and Finance->business governance",
    "Economy, Business and Finance->human resources"
  ],
  "ai_allow": true,
  "has_canonical": false,
  "breaking": true,
  "webz_reporter": false,
  "external_links": [],
  "entities": {
    "persons": [
      {
        "name": "Lazio",
        "sentiment": "neutral"
      },
      {
        "name": "lavorative che vedono al primo posto",
        "sentiment": "neutral"
      },
      {
        "name": "su straordinari e ferie",
        "sentiment": "neutral"
      },
      {
        "name": "organizzato allo Steri",
        "sentiment": "neutral"
      },
      {
        "name": "mancato pagamento di retribuzioni",
        "sentiment": "neutral"
      },
      {
        "name": "licenziamenti illegittimi",
        "sentiment": "neutral"
      },
      {
        "name": "su ferie",
        "sentiment": "neutral"
      },
      {
        "name": "permessi e",
        "sentiment": "neutral"
      },
      {
        "name": "Andrea Monteleone",
        "sentiment": "neutral"
      },
      {
        "name": "sia ai lavoratori",
        "sentiment": "neutral"
      },
      {
        "name": "al processo",
        "sentiment": "neutral"
      },
      {
        "name": "questo modo non dovranno gravarsi di ulteriori contenziosi»",
        "sentiment": "neutral"
      }
    ],
    "locations": [
      {
        "name": "La Sicilia",
        "sentiment": "neutral"
      },
      {
        "name": "lavorative",
        "sentiment": "neutral"
      },
      {
        "name": "insieme",
        "sentiment": "neutral"
      },
      {
        "name": "Lombardia",
        "sentiment": "neutral"
      },
      {
        "name": "Campania",
        "sentiment": "neutral"
      },
      {
        "name": "Puglia",
        "sentiment": "neutral"
      },
      {
        "name": "Palermo",
        "sentiment": "neutral"
      },
      {
        "name": "la conciliazione",
        "sentiment": "neutral"
      }
    ],
    "organizations": [
      {
        "name": "Sicilia tra le",
        "sentiment": "neutral",
        "tickers": []
      },
      {
        "name": "cinque regioni italiane per numero di",
        "sentiment": "neutral",
        "tickers": []
      },
      {
        "name": "lavorative\nSono quasi",
        "sentiment": "neutral",
        "tickers": []
      },
      {
        "name": "propri datori di lavoro\n",
        "sentiment": "neutral",
        "tickers": []
      },
      {
        "name": "aumento le",
        "sentiment": "neutral",
        "tickers": []
      },
      {
        "name": "come lo strumento della conciliazione sindacale sia",
        "sentiment": "neutral",
        "tickers": []
      },
      {
        "name": "stati diffusi",
        "sentiment": "neutral",
        "tickers": []
      },
      {
        "name": "il sindacato nazionale autonomo dei lavoratori e dei pensionati che domani",
        "sentiment": "neutral",
        "tickers": []
      },
      {
        "name": "Tra il 2019 e",
        "sentiment": "neutral",
        "tickers": []
      },
      {
        "name": "con una media di circa",
        "sentiment": "neutral",
        "tickers": []
      },
      {
        "name": "ai dati nazionali",
        "sentiment": "neutral",
        "tickers": []
      },
      {
        "name": "è quello di approfondire il ruolo e le potenzialità della conciliazione",
        "sentiment": "neutral",
        "tickers": []
      },
      {
        "name": "dei diritti e una maggiore partecipazione",
        "sentiment": "neutral",
        "tickers": []
      },
      {
        "name": "diventa un supporto essenziale di aiuto allo snellimento delle cause nei tribunali",
        "sentiment": "neutral",
        "tickers": []
      },
      {
        "name": "RIPRODUZIONE",
        "sentiment": "neutral",
        "tickers": []
      }
    ]
  },
  "syndication": {
    "syndicated": null,
    "syndicate_id": null,
    "first_syndicated": false
  },
  "trust": {
    "categories": []
  },
  "rating": null,
  "crawled": "2025-03-27T15:37:55.745+02:00",
  "updated": "2025-03-27T15:37:55.745+02:00"
}